{
  "skill": "gm-velocity-sting",
  "version": "1.1.1",
  "canvas": ["1:1"],
  "duration": { "min": 11.933, "max": 11.933 },
  "clock": "ledger",
  "slots": [
    { "id": "brand_word_1", "type": "text", "purpose": "A and G: the wordmark (whole, or its first part). From the brand kit name.", "from": "brand.name", "maxChars": 12, "mustBeReal": true, "aiFillable": false },
    { "id": "brand_word_2", "type": "text", "purpose": "A and G: the wordmark's second part, drawn in the accent. Empty for a one-word brand (the mark and the wordmark are already the two counter-bouncing parts).", "maxChars": 12, "mustBeReal": true, "aiFillable": false, "default": "" },
    { "id": "logo", "type": "logo", "purpose": "The brand mark (brand kit logo). Empty = a monogram in the accent.", "mustBeReal": true, "aiFillable": false, "default": "" },
    { "id": "b_title", "type": "text", "purpose": "B: the entry surface's title (sign-in, onboarding or first run).", "maxChars": 16, "aiFillable": true },
    { "id": "b_sub", "type": "text", "purpose": "B: one line under the title.", "maxChars": 36, "aiFillable": true },
    { "id": "b_option_1", "type": "text", "purpose": "B: first sign-in option the product really offers. Empty = none.", "maxChars": 24, "mustBeReal": true, "aiFillable": false, "default": "" },
    { "id": "b_option_2", "type": "text", "purpose": "B: second real sign-in option. Empty = none.", "maxChars": 24, "mustBeReal": true, "aiFillable": false, "default": "" },
    { "id": "b_divider", "type": "text", "purpose": "B and C: the divider text above the field.", "maxChars": 20, "aiFillable": true },
    { "id": "b_field_label", "type": "text", "purpose": "B and C: the field's label.", "maxChars": 14, "aiFillable": true },
    { "id": "b_placeholder", "type": "text", "purpose": "B and C: the field's placeholder.", "maxChars": 22, "aiFillable": true },
    { "id": "b_cta", "type": "text", "purpose": "B and C: the surface's button; its press in C ignites the cut.", "maxChars": 24, "mustBeReal": true, "aiFillable": false },
    { "id": "c_typed", "type": "text", "purpose": "C: what gets typed into the field. A sample value, never a real person's data.", "maxChars": 22, "aiFillable": true },
    { "id": "d_label", "type": "text", "purpose": "D: what the one number counts.", "maxChars": 20, "mustBeReal": true, "aiFillable": false },
    { "id": "d_from", "type": "number", "purpose": "D: where the count starts on screen.", "mustBeReal": true, "aiFillable": false },
    { "id": "d_to", "type": "number", "purpose": "D: the number users of the product would quote. Never invented.", "mustBeReal": true, "aiFillable": false },
    { "id": "d_of", "type": "text", "purpose": "D: the short line under the number (a unit or a total).", "maxChars": 20, "aiFillable": true },
    { "id": "d_steps", "type": "text_list", "purpose": "D: 0–4 real steps of the process behind the number; the first is done, the second is active and ticks done.", "maxChars": 24, "count": { "min": 0, "max": 4 }, "mustBeReal": true, "aiFillable": false },
    { "id": "e_rows", "type": "text_list", "purpose": "E: the product's real primary navigation, 3–5 rows. The first row is the one chosen.", "maxChars": 14, "count": { "min": 3, "max": 5 }, "mustBeReal": true, "aiFillable": false },
    { "id": "e_extra", "type": "text", "purpose": "E: one row after a divider (often Settings). Empty = none; then up to 5 main rows fit.", "maxChars": 14, "mustBeReal": true, "aiFillable": false, "default": "" },
    { "id": "e_foot", "type": "text", "purpose": "E: one line under the list, arriving with the choice.", "maxChars": 48, "aiFillable": true },
    { "id": "f_title", "type": "text", "purpose": "F: the page the chosen nav row opens.", "maxChars": 16, "mustBeReal": true, "aiFillable": false },
    { "id": "f_sub", "type": "text", "purpose": "F: one line under the page title.", "maxChars": 48, "aiFillable": true },
    { "id": "f_create", "type": "text", "purpose": "F: the product's real primary create button.", "maxChars": 16, "mustBeReal": true, "aiFillable": false },
    { "id": "f_secondary", "type": "text", "purpose": "F: a second real button beside it. Empty = none.", "maxChars": 24, "mustBeReal": true, "aiFillable": false, "default": "" },
    { "id": "f_menu_title", "type": "text", "purpose": "F: the heading of what the create button opens.", "maxChars": 22, "aiFillable": true },
    { "id": "f_menu_rows", "type": "text_list", "purpose": "F: exactly 4 real choices as {name, meta}; the second is chosen. name ≤ 18 chars, meta ≤ 14.", "count": { "min": 4, "max": 4 }, "itemFields": { "name": 18, "meta": 14 }, "mustBeReal": true, "aiFillable": false },
    { "id": "f_needs", "type": "text", "purpose": "F: what the choice asks for next.", "maxChars": 40, "aiFillable": true },
    { "id": "g_line", "type": "text", "purpose": "G: at most one closing line. Empty = the lockup alone.", "maxChars": 34, "aiFillable": true, "default": "" }
  ]
}
